{
  "version": "3.0",
  "status": "Active",
  "description": "Canonical Personal Wellness Blueprint outcomes linking user-stated wellness goals directly to body systems and biological mechanisms. Outcomes are the single goal/outcome vocabulary used throughout PWB - the same OUT-codes the questionnaire (PF014) offers as goal choices, that products and foods are tagged/scored against, and that PriorityScorer applies as a body-system bonus. The separate goals.json layer (GOAL### ids sitting between user intent and outcomes) has been retired as an unused extra layer - it was never read by any scoring code and the questionnaire already asked for outcomes directly.",
  "outcomes": [
    {
      "id": "OUT001",
      "name": "Better Sleep",
      "description": "Support better sleep quality and restorative recovery.",
      "goals": [],
      "primaryBodySystems": [
        "BS004",
        "BS008"
      ],
      "secondaryBodySystems": [
        "BS009"
      ],
      "candidateMechanisms": [
        "MEC057",
        "MEC058"
      ],
      "status": "Active"
    },
    {
      "id": "OUT002",
      "name": "More Energy",
      "description": "Support energy, vitality and physical stamina.",
      "goals": [],
      "primaryBodySystems": [
        "BS008",
        "BS004"
      ],
      "secondaryBodySystems": [
        "BS002",
        "BS003"
      ],
      "candidateMechanisms": [
        "MEC044",
        "MEC102"
      ],
      "status": "Active"
    },
    {
      "id": "OUT003",
      "name": "Healthy Weight Management",
      "description": "Support healthy weight and body composition.",
      "goals": [],
      "primaryBodySystems": [
        "BS008",
        "BS002"
      ],
      "secondaryBodySystems": [
        "BS004",
        "BS003"
      ],
      "candidateMechanisms": [
        "MEC040",
        "MEC041",
        "MEC043",
        "MEC044"
      ],
      "status": "Active"
    },
    {
      "id": "OUT004",
      "name": "Better Fitness & Physical Performance",
      "description": "Support physical fitness, strength, stamina and exercise performance.",
      "goals": [],
      "primaryBodySystems": [
        "BS009",
        "BS003",
        "BS004"
      ],
      "secondaryBodySystems": [
        "BS008"
      ],
      "candidateMechanisms": [
        "MEC092",
        "MEC102"
      ],
      "status": "Active"
    },
    {
      "id": "OUT005",
      "name": "Digestive & Gut Health",
      "description": "Support digestive comfort, regularity and healthy gut function.",
      "goals": [],
      "primaryBodySystems": [
        "BS001",
        "BS002"
      ],
      "secondaryBodySystems": [
        "BS005"
      ],
      "candidateMechanisms": [
        "MEC030",
        "MEC031",
        "MEC032",
        "MEC033",
        "MEC035",
        "MEC036",
        "MEC109",
        "MEC110",
        "MEC111",
        "MEC112",
        "MEC113"
      ],
      "status": "Active"
    },
    {
      "id": "OUT006",
      "name": "Mental Clarity & Cognitive Performance",
      "description": "Support concentration, focus, memory and cognitive performance.",
      "goals": [],
      "primaryBodySystems": [
        "BS004",
        "BS003"
      ],
      "secondaryBodySystems": [
        "BS008"
      ],
      "candidateMechanisms": [
        "MEC050",
        "MEC051",
        "MEC102",
        "MEC054",
        "MEC055"
      ],
      "status": "Active"
    },
    {
      "id": "OUT007",
      "name": "Mobility & Joint Health",
      "description": "Support mobility, joint function and comfortable movement.",
      "goals": [],
      "primaryBodySystems": [
        "BS009"
      ],
      "secondaryBodySystems": [
        "BS003",
        "BS004"
      ],
      "candidateMechanisms": [
        "MEC090",
        "MEC094",
        "MEC091"
      ],
      "status": "Active"
    },
    {
      "id": "OUT008",
      "name": "Healthy Ageing & Resilience",
      "description": "Support resilience, function and wellbeing across ageing.",
      "goals": [],
      "primaryBodySystems": [
        "BS003",
        "BS004",
        "BS005",
        "BS008",
        "BS009"
      ],
      "secondaryBodySystems": [
        "BS001",
        "BS002",
        "BS007"
      ],
      "candidateMechanisms": [
        "MEC040",
        "MEC044",
        "MEC051",
        "MEC060",
        "MEC090",
        "MEC102",
        "MEC111",
        "MEC091"
      ],
      "demographicModifiers": {
        "ageRanges": [
          "51-64",
          "65+"
        ]
      },
      "status": "Active"
    },
    {
      "id": "OUT009",
      "name": "Menopause Transition Resilience",
      "description": "Support wellbeing and resilience during the menopause transition.",
      "goals": [],
      "primaryBodySystems": [
        "BS008",
        "BS004",
        "BS009",
        "BS002"
      ],
      "secondaryBodySystems": [
        "BS003",
        "BS005"
      ],
      "candidateMechanisms": [
        "MEC083",
        "MEC085",
        "MEC107",
        "MEC108",
        "MEC091"
      ],
      "demographicModifiers": {
        "gender": [
          "Female"
        ],
        "ageRanges": [
          "40-50",
          "51-64",
          "65+"
        ]
      },
      "status": "Active"
    },
    {
      "id": "OUT010",
      "name": "Heart & Cardiovascular Health",
      "description": "Support healthy blood pressure, circulation and cardiovascular function.",
      "goals": [],
      "primaryBodySystems": [
        "BS003"
      ],
      "secondaryBodySystems": [],
      "candidateMechanisms": [
        "MEC013",
        "MEC002",
        "MEC010",
        "MEC011",
        "MEC012"
      ],
      "status": "Active"
    },
    {
      "id": "OUT011",
      "name": "Immune Resilience",
      "description": "Support healthy immune function, resilience and a balanced inflammatory response.",
      "goals": [],
      "primaryBodySystems": [
        "BS005"
      ],
      "secondaryBodySystems": [],
      "candidateMechanisms": [
        "MEC060",
        "MEC061",
        "MEC062",
        "MEC068",
        "MEC069"
      ],
      "status": "Active"
    },
    {
      "id": "OUT012",
      "name": "Sexual Health & Libido",
      "description": "Support healthy circulation and hormonal balance associated with sexual health and libido.",
      "goals": [],
      "primaryBodySystems": [
        "BS003",
        "BS008"
      ],
      "secondaryBodySystems": [],
      "candidateMechanisms": [
        "MEC011",
        "MEC010",
        "MEC086",
        "MEC083"
      ],
      "status": "Active"
    }
  ]
}
